{
  "schema_version": "1.0.0",
  "exported_at": "2026-07-20T01:58:30.510274-04:00",
  "reviewer_default": "RC",
  "note": "This is RC's (the teacher's) confirmed revision of the Grok-generated draft teacher_decisions.json (preserved untouched); every entry here is a proposal only and no registry writes are made.",
  "decisions": [
    {
      "section": 1,
      "decision_id": "s1-revive-or-retire-4-1",
      "target_item_uids": [],
      "registry_lines": [],
      "action": "revive-ingestion-only",
      "reviewer": "RC",
      "timestamp": "2026-07-20T01:58:30.509541-04:00",
      "note": "4-1 was deliberately cut from the prior pacing plan — not permanently excluded. Restore as OPTIONAL CATALOG content; do NOT automatically schedule it into any pacing sequence."
    },
    {
      "section": 2,
      "decision_id": "s2-5-4-savvas-q21",
      "target_item_uids": [
        "iu_c470845cd9f5",
        "iu_bf2e53fb5aaa"
      ],
      "registry_lines": [
        308,
        279
      ],
      "action": "needs-source-check",
      "reviewer": "RC",
      "timestamp": "2026-07-20T01:58:30.509613-04:00",
      "note": "For 5-4-savvas-q21: DOK labels remain unresolved pending source verification — consistent with rubric v0.2 rule 2 (\"Conflicting or provenance-missing textbook labels remain UNRESOLVED pending source verification\")."
    },
    {
      "section": 2,
      "decision_id": "s2-5-4-savvas-q22",
      "target_item_uids": [
        "iu_2687f61c33c5",
        "iu_84131456696f"
      ],
      "registry_lines": [
        309,
        280
      ],
      "action": "needs-source-check",
      "reviewer": "RC",
      "timestamp": "2026-07-20T01:58:30.509628-04:00",
      "note": "For 5-4-savvas-q22: DOK labels remain unresolved pending source verification — consistent with rubric v0.2 rule 2 (\"Conflicting or provenance-missing textbook labels remain UNRESOLVED pending source verification\")."
    },
    {
      "section": 2,
      "decision_id": "s2-5-4-savvas-q23",
      "target_item_uids": [
        "iu_e067aeabdb5e",
        "iu_5d11f886423f"
      ],
      "registry_lines": [
        310,
        281
      ],
      "action": "needs-source-check",
      "reviewer": "RC",
      "timestamp": "2026-07-20T01:58:30.509643-04:00",
      "note": "For 5-4-savvas-q23: DOK labels remain unresolved pending source verification — consistent with rubric v0.2 rule 2 (\"Conflicting or provenance-missing textbook labels remain UNRESOLVED pending source verification\")."
    },
    {
      "section": 2,
      "decision_id": "s2-5-4-savvas-q24",
      "target_item_uids": [
        "iu_da8e33db9d06",
        "iu_e106ef5ef48e"
      ],
      "registry_lines": [
        311,
        282
      ],
      "action": "needs-source-check",
      "reviewer": "RC",
      "timestamp": "2026-07-20T01:58:30.509652-04:00",
      "note": "For 5-4-savvas-q24: DOK labels remain unresolved pending source verification — consistent with rubric v0.2 rule 2 (\"Conflicting or provenance-missing textbook labels remain UNRESOLVED pending source verification\")."
    },
    {
      "section": 2,
      "decision_id": "s2-5-4-savvas-q25",
      "target_item_uids": [
        "iu_cd45fbec9dbc",
        "iu_8e4e2787396a"
      ],
      "registry_lines": [
        312,
        283
      ],
      "action": "needs-source-check",
      "reviewer": "RC",
      "timestamp": "2026-07-20T01:58:30.509660-04:00",
      "note": "For 5-4-savvas-q25: DOK labels remain unresolved pending source verification — consistent with rubric v0.2 rule 2 (\"Conflicting or provenance-missing textbook labels remain UNRESOLVED pending source verification\")."
    },
    {
      "section": 2,
      "decision_id": "s2-5-4-savvas-q26",
      "target_item_uids": [
        "iu_323815e656c9",
        "iu_68d1a5b3e8f8"
      ],
      "registry_lines": [
        313,
        284
      ],
      "action": "needs-source-check",
      "reviewer": "RC",
      "timestamp": "2026-07-20T01:58:30.509667-04:00",
      "note": "For 5-4-savvas-q26: DOK labels remain unresolved pending source verification — consistent with rubric v0.2 rule 2 (\"Conflicting or provenance-missing textbook labels remain UNRESOLVED pending source verification\")."
    },
    {
      "section": 2,
      "decision_id": "s2-5-4-savvas-q27",
      "target_item_uids": [
        "iu_26a15cb256cd",
        "iu_9681eda37337"
      ],
      "registry_lines": [
        314,
        285
      ],
      "action": "needs-source-check",
      "reviewer": "RC",
      "timestamp": "2026-07-20T01:58:30.509675-04:00",
      "note": "For 5-4-savvas-q27: DOK labels remain unresolved pending source verification — consistent with rubric v0.2 rule 2 (\"Conflicting or provenance-missing textbook labels remain UNRESOLVED pending source verification\")."
    },
    {
      "section": 2,
      "decision_id": "s2-5-4-savvas-q28",
      "target_item_uids": [
        "iu_d2eb395dfeee",
        "iu_18cac1a8167a"
      ],
      "registry_lines": [
        315,
        286
      ],
      "action": "needs-source-check",
      "reviewer": "RC",
      "timestamp": "2026-07-20T01:58:30.509684-04:00",
      "note": "For 5-4-savvas-q28: DOK labels remain unresolved pending source verification — consistent with rubric v0.2 rule 2 (\"Conflicting or provenance-missing textbook labels remain UNRESOLVED pending source verification\")."
    },
    {
      "section": 2,
      "decision_id": "s2-5-4-savvas-q29",
      "target_item_uids": [
        "iu_6eb3a7c167c0",
        "iu_e7638fcec56e"
      ],
      "registry_lines": [
        316,
        287
      ],
      "action": "needs-source-check",
      "reviewer": "RC",
      "timestamp": "2026-07-20T01:58:30.509692-04:00",
      "note": "For 5-4-savvas-q29: DOK labels remain unresolved pending source verification — consistent with rubric v0.2 rule 2 (\"Conflicting or provenance-missing textbook labels remain UNRESOLVED pending source verification\")."
    },
    {
      "section": 2,
      "decision_id": "s2-5-4-savvas-q30",
      "target_item_uids": [
        "iu_3646823c6297",
        "iu_32a6c3b34ca1"
      ],
      "registry_lines": [
        317,
        288
      ],
      "action": "needs-source-check",
      "reviewer": "RC",
      "timestamp": "2026-07-20T01:58:30.509701-04:00",
      "note": "For 5-4-savvas-q30: DOK labels remain unresolved pending source verification — consistent with rubric v0.2 rule 2 (\"Conflicting or provenance-missing textbook labels remain UNRESOLVED pending source verification\")."
    },
    {
      "section": 2,
      "decision_id": "s2-5-4-savvas-q31",
      "target_item_uids": [
        "iu_d8950c94a8bc",
        "iu_beec9e3bdf89"
      ],
      "registry_lines": [
        318,
        289
      ],
      "action": "needs-source-check",
      "reviewer": "RC",
      "timestamp": "2026-07-20T01:58:30.509708-04:00",
      "note": "For 5-4-savvas-q31: DOK labels remain unresolved pending source verification — consistent with rubric v0.2 rule 2 (\"Conflicting or provenance-missing textbook labels remain UNRESOLVED pending source verification\")."
    },
    {
      "section": 2,
      "decision_id": "s2-5-4-savvas-q32",
      "target_item_uids": [
        "iu_c1771afa2a7f",
        "iu_74cca3783f59"
      ],
      "registry_lines": [
        319,
        290
      ],
      "action": "needs-source-check",
      "reviewer": "RC",
      "timestamp": "2026-07-20T01:58:30.509715-04:00",
      "note": "For 5-4-savvas-q32: DOK labels remain unresolved pending source verification — consistent with rubric v0.2 rule 2 (\"Conflicting or provenance-missing textbook labels remain UNRESOLVED pending source verification\")."
    },
    {
      "section": 2,
      "decision_id": "s2-5-4-savvas-q33",
      "target_item_uids": [
        "iu_c6ab822e227b",
        "iu_3adc6df8b95d"
      ],
      "registry_lines": [
        320,
        291
      ],
      "action": "needs-source-check",
      "reviewer": "RC",
      "timestamp": "2026-07-20T01:58:30.509722-04:00",
      "note": "For 5-4-savvas-q33: DOK labels remain unresolved pending source verification — consistent with rubric v0.2 rule 2 (\"Conflicting or provenance-missing textbook labels remain UNRESOLVED pending source verification\")."
    },
    {
      "section": 2,
      "decision_id": "s2-5-4-savvas-q34",
      "target_item_uids": [
        "iu_748071c541b9",
        "iu_a96e5311a459"
      ],
      "registry_lines": [
        321,
        292
      ],
      "action": "needs-source-check",
      "reviewer": "RC",
      "timestamp": "2026-07-20T01:58:30.509729-04:00",
      "note": "For 5-4-savvas-q34: DOK labels remain unresolved pending source verification — consistent with rubric v0.2 rule 2 (\"Conflicting or provenance-missing textbook labels remain UNRESOLVED pending source verification\")."
    },
    {
      "section": 2,
      "decision_id": "s2-5-4-savvas-q35",
      "target_item_uids": [
        "iu_22bcc429d37c",
        "iu_3b2700252892"
      ],
      "registry_lines": [
        322,
        293
      ],
      "action": "needs-source-check",
      "reviewer": "RC",
      "timestamp": "2026-07-20T01:58:30.509737-04:00",
      "note": "For 5-4-savvas-q35: DOK labels remain unresolved pending source verification — consistent with rubric v0.2 rule 2 (\"Conflicting or provenance-missing textbook labels remain UNRESOLVED pending source verification\")."
    },
    {
      "section": 2,
      "decision_id": "s2-5-4-savvas-q36",
      "target_item_uids": [
        "iu_3c4458af5f01",
        "iu_5663d63244d2"
      ],
      "registry_lines": [
        323,
        294
      ],
      "action": "needs-source-check",
      "reviewer": "RC",